{
  "schemaVersion": 9,
  "source": {
    "command": "compare-cells"
  },
  "inputs": {
    "before": {
      "label": "test/fixtures/yuurei-cell/cell-a",
      "runId": "run-cell-a",
      "cellId": "cell_20260920-a1",
      "taskDigest": "sha256:task-x",
      "profileName": "p",
      "profileDigest": "sha256:p",
      "runtimeId": "claude-code",
      "requestedCellDigest": "sha256:req-cell",
      "observationStatus": "recorded",
      "exportObservedSnapshotId": "obs_0123456789ab",
      "exportResolvedSnapshotId": "res_0123456789ab"
    },
    "after": {
      "label": "test/fixtures/yuurei-cell/cell-b",
      "runId": "run-cell-b",
      "cellId": "cell_20260920-b2",
      "taskDigest": "sha256:task-x",
      "profileName": "p",
      "profileDigest": "sha256:p",
      "runtimeId": "claude-code",
      "requestedCellDigest": "sha256:req-cell",
      "observationStatus": "recorded",
      "exportObservedSnapshotId": "obs_b",
      "exportResolvedSnapshotId": "res_b"
    }
  },
  "entries": [
    {
      "lane": "association",
      "subject": "before",
      "id": "association.cell-id",
      "state": "recorded",
      "completeness": "complete",
      "statement": "the trace records cell_id 'cell_20260920-a1'",
      "evidence": [
        {
          "source": "beforeTrace",
          "pointer": "/cell_id"
        }
      ],
      "provenance": {
        "transform": [
          "compare-cells",
          "entry:association.cell-id"
        ]
      }
    },
    {
      "lane": "association",
      "subject": "before",
      "id": "association.observation",
      "state": "recorded",
      "completeness": "complete",
      "statement": "the observation record reports status 'recorded' from observer 'pfl' 1.2.0",
      "evidence": [
        {
          "source": "beforeTrace",
          "pointer": "/observation/observer/id"
        },
        {
          "source": "beforeTrace",
          "pointer": "/observation/status"
        }
      ],
      "provenance": {
        "transform": [
          "compare-cells",
          "entry:association.observation"
        ]
      }
    },
    {
      "lane": "association",
      "subject": "before",
      "id": "association.export-retained",
      "state": "verified",
      "completeness": "complete",
      "statement": "the manifest retains 'observation/export.json' and the stored bytes verify (3318 bytes)",
      "evidence": [
        {
          "source": "beforeTrace",
          "pointer": "/observation/artifacts"
        },
        {
          "source": "beforeManifest",
          "pointer": "/artifacts/6",
          "digest": "sha256:781a5b7309e3afcc50c55a14f8dc786e03d15bab108655c053518d1eae250e38"
        }
      ],
      "provenance": {
        "transform": [
          "compare-cells",
          "entry:association.export-retained"
        ]
      }
    },
    {
      "lane": "association",
      "subject": "before",
      "id": "association.export-document",
      "state": "verified",
      "completeness": "complete",
      "statement": "the retained bytes are a conforming pfl export document (pflVersion '1.2.0', completeness 'complete')",
      "evidence": [
        {
          "source": "beforeTrace",
          "pointer": "/observation"
        },
        {
          "source": "beforeManifest",
          "pointer": "/artifacts/6",
          "digest": "sha256:781a5b7309e3afcc50c55a14f8dc786e03d15bab108655c053518d1eae250e38"
        }
      ],
      "provenance": {
        "transform": [
          "compare-cells",
          "entry:association.export-document"
        ]
      }
    },
    {
      "lane": "association",
      "subject": "before",
      "id": "association.export-binding",
      "state": "verified",
      "completeness": "complete",
      "statement": "the export's recorded cellId 'cell_20260920-a1' equals the trace's cell_id — a recorded association between the run and the export's caller-asserted provenance, not proof of observation",
      "evidence": [
        {
          "source": "beforeTrace",
          "pointer": "/cell_id"
        },
        {
          "source": "beforeExport",
          "pointer": "/data/snapshot/cellId",
          "digest": "sha256:781a5b7309e3afcc50c55a14f8dc786e03d15bab108655c053518d1eae250e38"
        }
      ],
      "provenance": {
        "transform": [
          "compare-cells",
          "entry:association.export-binding"
        ]
      }
    },
    {
      "lane": "association",
      "subject": "before",
      "id": "association.export-snapshots",
      "state": "verified",
      "completeness": "complete",
      "statement": "the recorded snapshot_ids ('obs_0123456789ab', 'res_0123456789ab') equal the export's observed and resolved snapshot ids",
      "evidence": [
        {
          "source": "beforeTrace",
          "pointer": "/observation/snapshot_ids"
        },
        {
          "source": "beforeExport",
          "pointer": "/data/snapshot/observedSnapshotId",
          "digest": "sha256:781a5b7309e3afcc50c55a14f8dc786e03d15bab108655c053518d1eae250e38"
        },
        {
          "source": "beforeExport",
          "pointer": "/data/snapshot/resolvedSnapshotId",
          "digest": "sha256:781a5b7309e3afcc50c55a14f8dc786e03d15bab108655c053518d1eae250e38"
        }
      ],
      "provenance": {
        "transform": [
          "compare-cells",
          "entry:association.export-snapshots"
        ]
      }
    },
    {
      "lane": "association",
      "subject": "before",
      "id": "association.export-runtime",
      "state": "verified",
      "completeness": "complete",
      "statement": "the export's runtime.id 'claude-code' equals the trace's runtime.id",
      "evidence": [
        {
          "source": "beforeTrace",
          "pointer": "/runtime/id"
        },
        {
          "source": "beforeExport",
          "pointer": "/data/runtime/id",
          "digest": "sha256:781a5b7309e3afcc50c55a14f8dc786e03d15bab108655c053518d1eae250e38"
        }
      ],
      "provenance": {
        "transform": [
          "compare-cells",
          "entry:association.export-runtime"
        ]
      }
    },
    {
      "lane": "association",
      "subject": "before",
      "id": "association.export-completeness",
      "state": "verified",
      "completeness": "complete",
      "statement": "the observation record's completeness 'complete' equals the export's",
      "evidence": [
        {
          "source": "beforeTrace",
          "pointer": "/observation/completeness"
        },
        {
          "source": "beforeExport",
          "pointer": "/completeness",
          "digest": "sha256:781a5b7309e3afcc50c55a14f8dc786e03d15bab108655c053518d1eae250e38"
        }
      ],
      "provenance": {
        "transform": [
          "compare-cells",
          "entry:association.export-completeness"
        ]
      }
    },
    {
      "lane": "association",
      "subject": "before",
      "id": "association.export-source-project",
      "state": "not-recorded",
      "completeness": "unknown",
      "statement": "neither the trace's seed record nor the export records a source-project identity — the observed cell's source identity is unknown",
      "evidence": [
        {
          "source": "beforeTrace",
          "pointer": "/seed",
          "note": "no source_project field"
        },
        {
          "source": "beforeExport",
          "pointer": "/data/snapshot",
          "digest": "sha256:781a5b7309e3afcc50c55a14f8dc786e03d15bab108655c053518d1eae250e38"
        }
      ],
      "provenance": {
        "transform": [
          "compare-cells",
          "entry:association.export-source-project"
        ]
      }
    },
    {
      "lane": "association",
      "subject": "before",
      "id": "association.record-consistency",
      "state": "verified",
      "completeness": "complete",
      "statement": "the observation record is internally coherent (status 'recorded')",
      "evidence": [
        {
          "source": "beforeTrace",
          "pointer": "/observation"
        }
      ],
      "provenance": {
        "transform": [
          "compare-cells",
          "entry:association.record-consistency"
        ]
      }
    },
    {
      "lane": "configuration",
      "subject": "before",
      "id": "configuration.snapshot",
      "state": "recorded",
      "completeness": "complete",
      "statement": "the bound export identifies observed snapshot 'obs_0123456789ab', resolved snapshot 'res_0123456789ab', schema '2', captured '2026-09-20T09:59:00.000Z'",
      "evidence": [
        {
          "source": "beforeExport",
          "pointer": "/data/snapshot/capturedAt",
          "digest": "sha256:781a5b7309e3afcc50c55a14f8dc786e03d15bab108655c053518d1eae250e38"
        },
        {
          "source": "beforeExport",
          "pointer": "/data/snapshot/observedSnapshotId",
          "digest": "sha256:781a5b7309e3afcc50c55a14f8dc786e03d15bab108655c053518d1eae250e38"
        },
        {
          "source": "beforeExport",
          "pointer": "/data/snapshot/resolvedSnapshotId",
          "digest": "sha256:781a5b7309e3afcc50c55a14f8dc786e03d15bab108655c053518d1eae250e38"
        }
      ],
      "provenance": {
        "transform": [
          "compare-cells",
          "entry:configuration.snapshot"
        ]
      }
    },
    {
      "lane": "configuration",
      "subject": "before",
      "id": "configuration.subject",
      "state": "recorded",
      "completeness": "complete",
      "statement": "the export describes project 'path-0123456789abcdef' ('owner/repo') under runtime 'claude-code'",
      "evidence": [
        {
          "source": "beforeExport",
          "pointer": "/data/project/id",
          "digest": "sha256:781a5b7309e3afcc50c55a14f8dc786e03d15bab108655c053518d1eae250e38"
        },
        {
          "source": "beforeExport",
          "pointer": "/data/runtime/id",